{
  "schema_version": 1,
  "project_version": "2.4.0",
  "frp_version": "0.71.0",
  "channel": "development",
  "git_ref": "754cae8e1a42e8323caf51155f3a357d00ecabe5",
  "owner": "datarelay-labs",
  "repo": "datarelay-link",
  "https_raw_base": "https://raw.githubusercontent.com/datarelay-labs/datarelay-link",
  "signing": false,
  "integrity": {
    "sha256": true,
    "checksum_file": "SHA256SUMS"
  },
  "sbom": {
    "format": "spdx-json",
    "artifact": "dist/sbom.spdx.json",
    "generator": "scripts/generate-sbom.py",
    "verifier": "scripts/verify-sbom.sh",
    "committed": false,
    "available": true,
    "binds_to": "release source commit",
    "deterministic": true,
    "note": "Generated at release time from the checked-out release commit and published as an attested workflow artifact; not tracked in git, because a committed file cannot record the hash of the commit containing it. Excluded from SHA256SUMS: its inventory is built from SHA256SUMS, so checksumming it there would be circular. Deterministic for a fixed commit (SOURCE_DATE_EPOCH or HEAD commit time)."
  },
  "provenance": {
    "type": "github-artifact-attestation",
    "workflow": ".github/workflows/release-attest.yml",
    "available": false,
    "workflow_ready": true,
    "verification": "authoritative",
    "note": "Attestation is produced by the release-attest workflow, which must be dispatched from the immutable release tag. The workflow binds expected tag -> expected commit -> checked-out HEAD -> attested subjects before attesting, and its gh attestation verify step is authoritative: verification failure fails the release-integrity gate. There is no DEFERRED outcome. available=false until a verified attestation exists for the published candidate; workflow_ready=true means the workflow is present and validated in-tree."
  },
  "checksum_file": "SHA256SUMS",
  "supported_frp_versions": {
    "0.71.0": {
      "status": "tested",
      "amd64_sha256": "84f27e39f11169f7adcef8e8b70c9329de17747b1f14dad9fb95eef5682ea716",
      "arm64_sha256": "f33c293c275d8fc68c654b6fba8f10b2551d6463d09a9fc9cffb7227eae82266",
      "darwin_arm64_sha256": "45be02b186860d375ed49a8941ae9569628a54bf14e67fc36b29c98c99dabcc6",
      "windows_amd64_sha256": "9e5062e3e5cf07e67144a3a4acf175ef6a2486f3605dd6cf288bae34ab39819f",
      "websocket_path": "/~!frp"
    }
  },
  "note": "Checksums are integrity hashes from SHA256SUMS, not cryptographic signatures. This manifest describes the v2.4.0 candidate identity with immutable git_ref vPROJECT_VERSION and never mutable main. Dev channel (DRLINK_RELEASE_CHANNEL=dev or FRP_RELEASE_CHANNEL=dev) remains explicit opt-in via main after the tag. Top-level artifacts list official install/uninstall scripts; self-contained bundle manifests are separate and must not self-reference. Integrity (SHA256), SBOM (SPDX JSON), and GitHub Artifact Attestation are distinct evidence classes. Pretags / development trees pin git_ref and source_head to the exact HEAD SHA; never advertise a future stable tag before it exists. features.mcp_included=true after MCP Bridge/AI Access implementation.",
  "supply_chain": {
    "immutable_version_reference": "git tag vPROJECT_VERSION",
    "tag_policy": "Published tags are immutable and are never moved, deleted, recreated, retargeted, or force-pushed. A wrong tag is superseded by a new version tag.",
    "artifact_integrity": "SHA256SUMS verified by project-update before execution",
    "artifact_ordering": "scripts/build-release-artifacts.sh: build bundles -> update SHA256SUMS -> generate SBOM -> verify",
    "excluded_from_sha256sums": [
      "SHA256SUMS",
      "release-manifest.json",
      "dist/sbom.spdx.json"
    ],
    "sbom": "SPDX JSON via scripts/generate-sbom.py, gated by scripts/verify-sbom.sh",
    "provenance": "GitHub Artifact Attestations via .github/workflows/release-attest.yml (OIDC)",
    "version_consistency": "scripts/check-version-consistency.sh, derived from VERSION",
    "distinctions": [
      "checksum != artifact provenance",
      "artifact provenance != commit signature",
      "developer commit signing is not required for this release evidence set"
    ]
  },
  "artifacts": {
    "bootstrap-client.sh": {
      "path": "dist/bootstrap-client.sh",
      "url_path": "dist/bootstrap-client.sh",
      "sha256": "78b71d33519968cd3d36aba8049978945ad3872ddf71d15750c373b47d4ef5b4"
    },
    "bootstrap-client.ps1": {
      "path": "dist/bootstrap-client.ps1",
      "url_path": "dist/bootstrap-client.ps1",
      "sha256": "4c6ea88a932c310033204834f2bf323ee1f6b8bdbfb5604f789268ba943d26dd"
    },
    "bootstrap-server.sh": {
      "path": "dist/bootstrap-server.sh",
      "url_path": "dist/bootstrap-server.sh",
      "sha256": "fb89d486b702f27a3a412b5333d8cfc57a0a76284b6567d4fb0ceb24657dec31"
    },
    "uninstall-client.sh": {
      "path": "dist/uninstall-client.sh",
      "url_path": "dist/uninstall-client.sh",
      "sha256": "c7ac1ebc4ed5dc0ca8f6d67531a8b15a16aac2fa33dbddaab99c9e41f1387554"
    },
    "uninstall-server.sh": {
      "path": "dist/uninstall-server.sh",
      "url_path": "dist/uninstall-server.sh",
      "sha256": "e49f8fbf55301fb00ce456cb880fb0e3083e216f7e44404f406e9de8362671c7"
    }
  },
  "source_head": "754cae8e1a42e8323caf51155f3a357d00ecabe5",
  "features": {
    "mcp_included": true
  },
  "immutable_source_ref": "754cae8e1a42e8323caf51155f3a357d00ecabe5"
}
